{"event_digest":"sha256:f7a7e84eda50934abcd58a38fdd74fd354185f0fc3fcaa56bc6c0489a2a58aae","event_index":1,"input_digests":[],"output_descriptors":[{"byte_length":239,"digest":"sha256:b8e9c07a3cbd37d62dfd522cb21dbd31d0ce072580e83b8b6cd9b1a3c5185c54","label":"maintenance.json","repo_relative_path":"catalog/runs/run_9c8c2c0635a84eba/outputs/maintenance.json"}],"phase":"maintenance","prev_event_digest":"sha256:67ecc5e725b3c525c7593bec4b33d82f2e48332519ce00150e48fef4c6312b03","run_id":"run_9c8c2c0635a84eba","timestamp":"2026-08-05T15:17:13.000Z"}
