{"event_digest":"sha256:480c8601c0f1bea36878f971b8b22581ea0f573e0fbc2ab254433114ad5d7af2","event_index":9,"input_digests":[],"output_descriptors":[{"byte_length":10638,"digest":"sha256:d357ae16173b753fdb13b137e47b9ff1e8ca763f1d0a04b7aedb50e42eca09cd","label":"audit_run_bc31520c3a704c07.json","repo_relative_path":"catalog/runs/run_bc31520c3a704c07/outputs/audit_run_bc31520c3a704c07.json"}],"phase":"audit","prev_event_digest":"sha256:75f8d8195a6e18a17820bbcdba0a2011f7a5bf1ce065f3be0ef019a87422dea3","run_id":"run_bc31520c3a704c07","timestamp":"2026-08-05T13:11:24.145Z"}
