{"event_digest":"sha256:0a57712fe4e31cfb84ce71aac6d6b7726f8513161ad0c480c0190032ede977da","event_index":4,"input_digests":[],"output_descriptors":[{"byte_length":1803,"digest":"sha256:7fbd8010d91652ba09ee4ec08243ace09a32630fffd7b7cec0c9a27ec9af1469","label":"run-context.json","repo_relative_path":"catalog/runs/run_9029deeaa50949fd/outputs/run-context.json"}],"phase":"context","prev_event_digest":"sha256:6a63c402845374aab4bf1717273a4c1d989dd4ce42c9e8b1843544b4f387450b","run_id":"run_9029deeaa50949fd","timestamp":"2026-08-05T14:41:22.939Z"}
