{"event_digest":"sha256:c36e021646fd2a8e4142f7614ee54b980bd430ced93d4f9eee65b9661e7af315","event_index":2,"input_digests":[],"output_descriptors":[{"byte_length":478,"digest":"sha256:63161697b86299a6046fb3a1753f85e6f7c15f17e8c6580d1541fda85371580f","label":"issues-prepared.json","repo_relative_path":"catalog/runs/run_9fb3a893884449cb/outputs/issues-prepared.json"}],"phase":"issues","prev_event_digest":"sha256:54de6d9f1ccb2cc92bcc88d7b4beb48230774ad97f5b8d90a454c31a6dd4a164","run_id":"run_9fb3a893884449cb","timestamp":"2026-08-05T11:12:09.739Z"}
