{"event_digest":"sha256:c02fd5afebf56bcb4d0796069974c5701cce71e09c9c28563c941082a82609ad","event_index":0,"input_digests":[],"output_descriptors":[{"byte_length":118,"digest":"sha256:f214bcb899f6c82f7d9ee828bca70130384107a19f40aaf1d1dcac9c39701ece","label":"init-evidence.json","repo_relative_path":"catalog/runs/run_7bc1f348e3534bc6/outputs/init-evidence.json"}],"phase":"init","prev_event_digest":null,"run_id":"run_7bc1f348e3534bc6","timestamp":"2026-08-05T11:08:18.055Z"}
