{"event_digest":"sha256:4f45d86694ff863ee07971f641e434df954e64897f2ea5dc64bc5777b75fc416","event_index":2,"input_digests":[],"output_descriptors":[{"byte_length":470,"digest":"sha256:96ae647b74bf1a6981cf6cc80c24a25d558c88d9ca25f9f1f9489959aed37d2b","label":"terminal.json","repo_relative_path":"catalog/runs/run_96280d2e5b274305/outputs/terminal.json"}],"phase":"terminal","prev_event_digest":"sha256:2cc19555594e49869cb319aaf6e7fcb91626facd30d2a62dd0fbc7e53a0e5ce9","run_id":"run_96280d2e5b274305","timestamp":"2026-08-05T11:10:08.773Z"}
