{"event_digest":"sha256:27f38638f4981c1185a3252d96f0bc1dd44993659286a8ac6c5dab9a5806b982","event_index":3,"input_digests":[],"output_descriptors":[{"byte_length":512,"digest":"sha256:81c4653d36b137bc42a95555e2ca00c03204556fc170783d8efa64be6544d113","label":"terminal.json","repo_relative_path":"catalog/runs/run_5facf864faa04b72/outputs/terminal.json"}],"phase":"terminal","prev_event_digest":"sha256:94080941e07fa60e61952f9ac577eca442a6941e068153e7a3a8142fe3018cf3","run_id":"run_5facf864faa04b72","timestamp":"2026-08-02T05:23:57.459Z"}
