{"event_digest":"sha256:7afdee150641474635f3c9650f8f718fb7e57f93e827141d31f325bb2172d36a","event_index":10,"input_digests":[],"output_descriptors":[{"byte_length":494,"digest":"sha256:1b30c33889ccb02e63358e49755d3f9957169f2a142f56ba054216bab9569683","label":"terminal.json","repo_relative_path":"catalog/runs/run_22011485d59049d8/outputs/terminal.json"}],"phase":"terminal","prev_event_digest":"sha256:1981df001e9f27eb607c43e1e8bbe579aeafa0104b66f210c36be1736d999e97","run_id":"run_22011485d59049d8","timestamp":"2026-08-06T09:22:51.876Z"}
