{"event_digest":"sha256:305a7337ee4eb9afc2c471d39aaed347ad856cd72c6009a72e35a5d92a50a674","event_index":2,"input_digests":[],"output_descriptors":[{"byte_length":473,"digest":"sha256:026b8522de519cd4a229dcd57582f3b1824e8eeefdba64b91b5c7f29287d7d54","label":"terminal.json","repo_relative_path":"catalog/runs/run_9c8c2c0635a84eba/outputs/terminal.json"}],"phase":"terminal","prev_event_digest":"sha256:f7a7e84eda50934abcd58a38fdd74fd354185f0fc3fcaa56bc6c0489a2a58aae","run_id":"run_9c8c2c0635a84eba","timestamp":"2026-08-05T15:17:13.002Z"}
