{"event_digest":"sha256:7cb6ef981ed3d84314cc5e3679360e142ca858813a1ccb6b35208cf968a3539f","event_index":7,"input_digests":[],"output_descriptors":[{"byte_length":12658,"digest":"sha256:06e96ce1f9057f18389b13e1f9ea22b8b3184332289826c662aba102c4a4ca7f","label":"gate-result.json","repo_relative_path":"catalog/runs/run_3a003f91e0c54412/outputs/gate-result.json"}],"phase":"gate","prev_event_digest":"sha256:becff7ee623165550ab53202b5799eb313b1985e60243d9126e87e817c09572e","run_id":"run_3a003f91e0c54412","timestamp":"2026-08-05T11:49:53.966Z"}
