{"event_digest":"sha256:2c2d2d51617de1a2b959c3ef991b2477064cd8e4cd7b428020e1b1fdcb302ea4","event_index":1,"input_digests":[],"output_descriptors":[{"byte_length":2198,"digest":"sha256:236b4209e183354ba74470f709abee332751bab883121b55e82b8e5a4b1089b5","label":"maintenance.json","repo_relative_path":"catalog/runs/run_ab1ac3aeb6a84e86/outputs/maintenance.json"}],"phase":"maintenance","prev_event_digest":"sha256:ee05d0e09ceb8f958a34a8ab1a41974b27899a289fe17e038f170c882683235e","run_id":"run_ab1ac3aeb6a84e86","timestamp":"2026-08-05T11:35:35.259Z"}
