{"event_digest":"sha256:a43868a6a30121c4b6f7c8c6e2fea44ea149979405b5b16c333c87f85277007b","event_index":7,"input_digests":[],"output_descriptors":[{"byte_length":12659,"digest":"sha256:2526c042e1d133471799c5818847c42bf379007b6ccbc24af6020a6b1ab58332","label":"gate-result.json","repo_relative_path":"catalog/runs/run_e707991dc51e48e5/outputs/gate-result.json"}],"phase":"gate","prev_event_digest":"sha256:01adad445f63b8b6d6b32c7211ea9d1d66806ade19a9a5830c34cecc166acc3f","run_id":"run_e707991dc51e48e5","timestamp":"2026-08-05T15:31:19.688Z"}
