{"event_digest":"sha256:d571e092361c73c1943d797adb2781bcce40a2bca4d82270232639e1fdfc2a24","event_index":1,"input_digests":[],"output_descriptors":[{"byte_length":239,"digest":"sha256:b8e9c07a3cbd37d62dfd522cb21dbd31d0ce072580e83b8b6cd9b1a3c5185c54","label":"maintenance.json","repo_relative_path":"catalog/runs/run_eba2cf52c61d45c7/outputs/maintenance.json"}],"phase":"maintenance","prev_event_digest":"sha256:1c694275980c1615ab79ec220f6608461f1714c4ff0095ffb1ed7132d198ed15","run_id":"run_eba2cf52c61d45c7","timestamp":"2026-08-05T15:11:29.522Z"}
