{"event_digest":"sha256:89eba2a807c24593dd1252f129f223e024a96be4a59f647d0f6bf14b7f182b7f","event_index":7,"input_digests":[],"output_descriptors":[{"byte_length":12604,"digest":"sha256:6622786ea996b6319139f082ac60fa8f723420acb2928fad9dd6aab5be80d3e3","label":"gate-result.json","repo_relative_path":"catalog/runs/run_95f5eeec43304235/outputs/gate-result.json"}],"phase":"gate","prev_event_digest":"sha256:da161962953374696fde2d21976c9fe14b49f38bda72bc4219d4aa43d6493837","run_id":"run_95f5eeec43304235","timestamp":"2026-08-06T11:42:11.850Z"}
