{"event_digest":"sha256:939139b93830b4bad3f4a8baf571aa412304abba6d158c9fa2ae0a2f02016a3d","event_index":4,"input_digests":[],"output_descriptors":[{"byte_length":1835,"digest":"sha256:f985b4f8a38bf82f1e72e60458bd6c7061e50b24d577c6fd74c27dbff7196532","label":"run-context.json","repo_relative_path":"catalog/runs/run_95f5eeec43304235/outputs/run-context.json"}],"phase":"context","prev_event_digest":"sha256:4df110402699031eaf064c31bb831848a4175156d25843cad0358ba00fffad6a","run_id":"run_95f5eeec43304235","timestamp":"2026-08-06T11:40:43.232Z"}
