{"event_digest":"sha256:ca226be5e04a70df1ef5865a558189cc7a5179efe330dcd467d86b9073529284","event_index":4,"input_digests":[],"output_descriptors":[{"byte_length":502,"digest":"sha256:6f99a68b476c6ddeecbaeb2c18401d1a6889180020a23f3b4854d42f04ba98a0","label":"terminal.json","repo_relative_path":"catalog/runs/run_694395f9df524371/outputs/terminal.json"}],"phase":"terminal","prev_event_digest":"sha256:3e621fd6908f6eb46184d1738f4441d4fa3eef795484013ba3c7522b3b107924","run_id":"run_694395f9df524371","timestamp":"2026-08-05T14:32:30.272Z"}
