{"event_digest":"sha256:82e02fdcd61b963aa583375a9c4768b386b7e479e4681587961c428804c86142","event_index":1,"input_digests":[],"output_descriptors":[{"byte_length":2198,"digest":"sha256:236b4209e183354ba74470f709abee332751bab883121b55e82b8e5a4b1089b5","label":"maintenance.json","repo_relative_path":"catalog/runs/run_bc31520c3a704c07/outputs/maintenance.json"}],"phase":"maintenance","prev_event_digest":"sha256:c29b47156749dd997ff8f6681b7bd24916cdae612e055465447f2820d2ff9c54","run_id":"run_bc31520c3a704c07","timestamp":"2026-08-05T13:09:19.580Z"}
