{"event_digest":"sha256:c4f4b24ddb3686618b727d035ad0c3b1c763df5a1ef00104f3ed1e486de1dcba","event_index":2,"input_digests":[],"output_descriptors":[{"byte_length":478,"digest":"sha256:3e9bb47386922249f818e226a87d90784b6a55d8edf229b04cde36479e6d4ffa","label":"issues-prepared.json","repo_relative_path":"catalog/runs/run_c3f3436e0a3443dd/outputs/issues-prepared.json"}],"phase":"issues","prev_event_digest":"sha256:e93bce19c76837d75f5d034a58fe6dfe94d311177f4e6815acaa0ce0ff78f226","run_id":"run_c3f3436e0a3443dd","timestamp":"2026-08-05T10:47:29.645Z"}
