{"event_digest":"sha256:1e60767ee4c66386b04013d4c7403837ac5d6836f25db1b36372c8313bb3c1c7","event_index":0,"input_digests":[],"output_descriptors":[{"byte_length":118,"digest":"sha256:09eb1564235573d6f9b179bb0cb0dc799cb7228ba21f27a9f7f3c75d35584ad1","label":"init-evidence.json","repo_relative_path":"catalog/runs/run_e707991dc51e48e5/outputs/init-evidence.json"}],"phase":"init","prev_event_digest":null,"run_id":"run_e707991dc51e48e5","timestamp":"2026-08-05T15:28:06.874Z"}
