{"event_digest":"sha256:1981df001e9f27eb607c43e1e8bbe579aeafa0104b66f210c36be1736d999e97","event_index":9,"input_digests":[],"output_descriptors":[{"byte_length":10638,"digest":"sha256:163d635503e57c251245d56966229d66d7aabca1bd70e12ef836989f56181a8c","label":"audit_run_22011485d59049d8.json","repo_relative_path":"catalog/runs/run_22011485d59049d8/outputs/audit_run_22011485d59049d8.json"}],"phase":"audit","prev_event_digest":"sha256:9aad4034f194b3a8972c0bae7916cb76127657194efb98b8bf31d9d63f51a818","run_id":"run_22011485d59049d8","timestamp":"2026-08-06T09:22:51.873Z"}
