{"event_digest":"sha256:536485c4fa806ddd101a0cfb3150b9b709cbd846713a5d9215ccd2eb1e02d3af","event_index":0,"input_digests":[],"output_descriptors":[{"byte_length":118,"digest":"sha256:664661c3eed4c314b1f58a1871cb4a02c647fd0aa1b4a01835b6895030181926","label":"init-evidence.json","repo_relative_path":"catalog/runs/run_6a603cef5210474c/outputs/init-evidence.json"}],"phase":"init","prev_event_digest":null,"run_id":"run_6a603cef5210474c","timestamp":"2026-08-05T14:36:50.773Z"}
