{"event_digest":"sha256:33d0c898f9c2b360e10383ded1de7e300087aa900c4ce1156b86dbe6c9ecbfca","event_index":1,"input_digests":[],"output_descriptors":[{"byte_length":2198,"digest":"sha256:236b4209e183354ba74470f709abee332751bab883121b55e82b8e5a4b1089b5","label":"maintenance.json","repo_relative_path":"catalog/runs/run_1d31608d12334a32/outputs/maintenance.json"}],"phase":"maintenance","prev_event_digest":"sha256:c964071ec65d95e4d849b66f88f924214d165756024b8bf1d1fd72e19d9aa77f","run_id":"run_1d31608d12334a32","timestamp":"2026-08-05T11:33:14.344Z"}
