{"event_digest":"sha256:e9a49dd8d18e60a356781fbd2c76c3264c4545f1bcb7c9df3e12f4a52ab3abf1","event_index":2,"input_digests":[],"output_descriptors":[{"byte_length":478,"digest":"sha256:0bbfcac00cbd701f282c3bdfd296f24bf460b908c2d5b8bcbd4899b2a56d31c1","label":"issues-prepared.json","repo_relative_path":"catalog/runs/run_e707991dc51e48e5/outputs/issues-prepared.json"}],"phase":"issues","prev_event_digest":"sha256:520e7cb037935a29c878d1bb9c8d101166def9f0b620c9fe334034f8f29afc88","run_id":"run_e707991dc51e48e5","timestamp":"2026-08-05T15:28:49.974Z"}
