{"event_digest":"sha256:51a46c85f3ffd310b29277ec3fa63ea9de3f465ebc7328dcc0fdf7d56a6cf966","event_index":1,"input_digests":[],"output_descriptors":[{"byte_length":856,"digest":"sha256:3c79cce3720dd2d8b4f9b5a9ad2050a0b9bd6d3d1ab4022928ee770b378617e8","label":"maintenance.json","repo_relative_path":"catalog/runs/run_78dba09339bb440d/outputs/maintenance.json"}],"phase":"maintenance","prev_event_digest":"sha256:a7336d8bf4f32fe00dc334be97c944563f28183927ab4c640c73faa624fa13fc","run_id":"run_78dba09339bb440d","timestamp":"2026-07-28T18:56:51.289Z"}
